ID,Title,ISBN,no,"
Proposed_by",Book_number
548,คำอธิบายกฎหมายว่าด้วยประกันภัย ประกันวินาศภัย ประกันชีวิต ประกันภัยภาคบังคับ,9.78974E+12,3,คณะกรรมการบริหารจัดการฯ,KPT998 จ634 2555
549,คำอธิบายประมวลกฎหมายแพ่งและพาณิชย์ ว่าด้วยประกันภัย,9.78974E+12,3,คณะกรรมการบริหารจัดการฯ,KPT998 ช882 2556
550,คำอธิบายประมวลกฎหมายแพ่งและพาณิชย์ บรรพ 6 ว่าด้วย มรดก,9.78974E+12,3,คณะกรรมการบริหารจัดการฯ,KPT770 อ599 2557
551,การเลิกคดีอาญา (การเปรียบเทียบคดีอาญา),9.78974E+11,1,คณะกรรมการบริหารจัดการฯ,K ธ699ก
552,ถอดความ : Code & Decode พระราชบัญญัติเพิ่มเติม ประมวลกฎหมายวิธีพิจารณาความแพ่ง (ฉบับที่ 26) พ.ศ.2558,9.78974E+12,3,คณะกรรมการบริหารจัดการฯ,KPT1710 ส822 2558
553,พระธรรมนูญศาลยุติธรรม สาระสังเขปประกอบบทบัญญั ติ สาระความรู้เกี่ยวกับเขตอำนาจศาลยุติธรรม,9.78974E+12,1,คณะกรรมการบริหารจัดการฯ,JQ1748 ช196 2557
554,ศาลกับดุลพินิจในการลงโทษ คดีเมาแล้วขับ,9.78974E+12,3,คณะกรรมการบริหารจัดการฯ,KPT3450 ศ364 2556
555,ความรู้พื้นฐานเกี่ยวกับลิขสิทธิ์ไทย,9.78974E+12,1,คณะกรรมการบริหารจัดการฯ,KPT1155 พ753
556,คดียกฟ้องจากเรื่องจริง ตอน ถามอย่างไรให้ชนะคดี,9.78616E+12,2,คณะกรรมการบริหารจัดการฯ,K5418 ช134 2558
557,หลักการและเทคนิคการเขียนงานวิจัย วิทยานิพนธ์ และรายงาน,9.78617E+12,3,คณะกรรมการบริหารจัดการฯ,LB2369 ว689 2556
558,การบริหารจัดการและการบริหารยุทธศาสตร์ของหน่วย งานของรัฐ,9.78617E+12,1,คณะกรรมการบริหารจัดการฯ,JQ1745 ว689
559,50 แนวคิด ตัวชี้วัด ตัวแบบของการบริหารจัดการแ ละการบริหารจัดการที่ยั่งยืน,9.78617E+12,2,คณะกรรมการบริหารจัดการฯ,HD37.T5 ว689 2559
560,การบริหารจัดการตามแนวคิดตะวันออก,9.78617E+12,2,คณะกรรมการบริหารจัดการฯ,HD38.2 ว689 2557
561,เทคนิคการคุมงานก่อสร้าง,9.78617E+12,1,คณะกรรมการบริหารจัดการฯ,TH438 ร113 2558
562,ประมวลกฎหมายอาญา ปี 2560 (เล่มจิ๋ว),9.78616E+12,2,คณะกรรมการบริหารจัดการฯ,KPT4610 น114 2560
563,กฎหมายภาษีอากร-ประมวลรัษฎากร ปี 2560,9.78616E+12,2,คณะกรรมการบริหารจัดการฯ,KPT3550 ก114 2560
564,รัฐธรรมนูญแห่งราชอาณาจักรไทย พุมธศักราช 2560,9.78616E+12,3,คณะกรรมการบริหารจัดการฯ,KPT2070 ร355 2560
565,คำถามพร้อมธงคำตอบ ข้อสอบคัดเลือกเพื่อบรรจุเป็นข้าราชการอัยการ ในตำแหน่งอัยการผู้ช่วยตั้งแต่ พ.ศ.2519,9.78616E+12,2,คณะกรรมการบริหารจัดการฯ,KPT70 ร122 2559
566,พระราชบัญญัติล้มละลาย ปรับปรุงใหม่ พ.ศ.2559,9.78616E+12,2,คณะกรรมการบริหารจัดการฯ,KPT1942 พ371ป 2559
567,หลักกฎหมายการคลัง,9.78616E+12,5,คณะกรรมการบริหารจัดการฯ,KPT3526 อ929 2558
568,กฎหมายทรัพย์สินทางปัญญา,9.78617E+12,3,คณะกรรมการบริหารจัดการฯ,KPT1155 ค148
569,หลักกฎหมายมรดก,9.78616E+12,3,คณะกรรมการบริหารจัดการฯ,KPT770 ม347 2558
570,ไต่สวนฉุกเฉิน ไต่สวนคุ้มครองชั่วคราว ร้องขอกันส่วน ร้องขัดทรัพย์ ร้องขอกันส่วน ร้องขัดทรัพย์ ร้องขอรับชำระหนี้จำนอง,9.78974E+12,1,คณะกรรมการบริหารจัดการฯ,KPT1749 ส284 2553
571,คำอธิบายกฎหมายลักษณะทรัพย์ : พร้อมถามตอบอัตนัยตามแนวคำพิพากษาศาลฎีกา,9.78974E+12,1,คณะกรรมการบริหารจัดการฯ,KPT640 ส355 2555
572,คู่มือศึกษาวิชากฎหมายพาณิชยนาวี,9.78616E+12,2,หมวดกฎหมายระหว่างประเทศ,KD1819 ผ951 2559
573,หลักกฎหมายบุคคล,9.78616E+12,5,หมวดกฎหมายระหว่างประเทศ,KPT511 ก675 2559
574,ทฤษฎีกฎหมายนิติปรัชญา,9.78616E+12,2,หมวดกฎหมายระหว่างประเทศ,K231 ส274 2559
575,นิติปรัชญา,9.78974E+12,2,หมวดกฎหมายระหว่างประเทศ,K230 ป472 2559
576,ทางเลือกในการระงับข้อพิพาทอนุญาโตตุลาการ,9.78616E+12,2,หมวดกฎหมายระหว่างประเทศ,KPT1829 อ165 2558
577,คำอธิบายกฎหมายการลงทุนระหว่างประเทศ,9.78974E+12,5,หมวดกฎหมายระหว่างประเทศ,KPT3405 ด839 2558
578,คำอธิบาย ปพพ.ว่าด้วยสัญญา,9.78974E+12,2,หมวดกฎหมายระหว่างประเทศ,KPT858 จ419
579,คำอธิบาย ปพพ.ว่าด้วยหุ้นส่วนและบริษัท,9.78974E+12,2,หมวดกฎหมายระหว่างประเทศ,KPT1045 ส979ป 2556
580,คำอธิบาย ปพพ.ว่าด้วยหนี้ บรรพ 2,9.78974E+12,2,หมวดกฎหมายระหว่างประเทศ,KPT810 ท672
581,คำอธิบาย ปพพ.จัดการงานนอกสั่ง ลาภมิควรได้ ละเมิด,9.78974E+12,2,หมวดกฎหมายระหว่างประเทศ,KPT864.3 จ419 2557
582,คำอธิบาย ปพพ.ค้ำประกัน จำนอง จำนำเก็บของในคลังสินค้าฯ,9.78974E+12,2,หมวดกฎหมายระหว่างประเทศ,KPT900 ส768 2556
583,กฎหมายรัฐธรรมนูญ แนวคิดและประสบการณ์ของต่างปรระเทศ,9.78616E+12,5,หมวดกฎหมายระหว่างประเทศ,KPT2110 ช486 2559
584,กฎหมายรัฐธรรมนูญจีน,9.78616E+12,2,หมวดกฎหมายระหว่างประเทศ,JQ1503 อ785 2558
585,หลักกฎหมายห้างหุ้นส่วน บริษัทจำกัด และบริษัทมหาชนจำกัด,9.78616E+12,2,หมวดกฎหมายระหว่างประเทศ,KPT1045 น157 2558
586,คำอธิบายกฎหมายลักษณะละเมิด จัดการงานนอกสั่ง ลาภมิควรได้,9.78616E+12,2,หมวดกฎหมายระหว่างประเทศ,KPT834 ศ125 2558
587,คำอธิบายกฎหมายลักษณะ ซื้อขาย แลกเปลี่ยน ให้,9.78616E+12,2,หมวดกฎหมายระหว่างประเทศ,KPT874 ศ125 2559
588,กฎหมายความรับผิดต่อความเสียหายที่เกิดขึ้นจากสินค้าที่ไม่ปลอดภัย,9.78616E+12,2,หมวดกฎหมายระหว่างประเทศ,KPT3276 ศ321 2559
589,ประวัติศาสตร์กฎหมายไทย,9.78616E+12,10,หมวดกฎหมายระหว่างประเทศ,K ส968ป 2558
590,ความรู้ทั่วไปเกี่ยวกับกฎหมาย,9.78616E+12,2,หมวดกฎหมายระหว่างประเทศ,KPT68 ร165 2559
591,คำอธิบายนิติกรรม-สัญญา พร้อมคำอธิบายในส่วนของง พ.ร.บ. ว่าด้วยข้อสัญญาที่ไม่เป็นธรรม พ.ศ. 2540,9.78616E+12,5,หมวดกฎหมายระหว่างประเทศ,KPT504 ศ125 2559
592,ความรู้กฎหมายทั่วไป คำอธิบายวิชากฎหมายแพ่ง หล ลักทั่วไป,9.78616E+12,2,หมวดกฎหมายระหว่างประเทศ,KPT500 ส274ค 2559
593,คำอธิบายกฎหมาย เช่าทรัพย์ - เช่าซื้อ,9.78616E+12,2,หมวดกฎหมายระหว่างประเทศ,KPT886.3 ศ125 2558
594,คำอธิบายตั๋วเงิน,9.78616E+12,2,หมวดกฎหมายระหว่างประเทศ,KPT938 ส447 2559
595,คำอธิบายศัพท์นิติกรรม-สัญญา,9.78616E+12,2,หมวดกฎหมายระหว่างประเทศ,KPT26 ศ125อ 2559
596,ประมวลกฎหมายวิธีพิจารณาความอาญา (ฉบับอ้างอิง) :ตัวบท คำอธิบายย่อและเอกสารอ้างอิง เรียงมาตรา,9.78616E+12,2,หมวดกฎหมายระหว่างประเทศ,KPT4610 ส854 2559
597,ถาม-ตอบ เอกเทศสัญญา 2 จ้างแรงงาน จ้างทำของ รัับขน ยืม ฝากทรัพย์ เจ้าสำนักโรงแรม ตัวแทน นายหน้า,9.78616E+12,2,หมวดกฎหมายระหว่างประเทศ,KPT874 ผ951ถ 2559
598,การคุ้มครองและรักษาสิ่งแวดล้อมทางทะเลจากภาวะมลพิษจากแหล่งบนบก,9.78616E+12,2,หมวดกฎหมายระหว่างประเทศ,KPT3127 ข634 2558
599,ความรู้ทั่วไปกฎหมายภาษี ตามประมวลรัษฎากร,9.78616E+11,2,หมวดกฎหมายระหว่างประเทศ,KPT3550 ท365 2559
600,คู่มือสอบกฎหมายปกครอง,9.78616E+12,2,หมวดกฎหมายระหว่างประเทศ,KPT2720 ส866ค 2558
601,คู่มือสอบกฎหมายรัฐธรรมนูญ,9.78616E+12,2,หมวดกฎหมายระหว่างประเทศ,KPT2070 ส866ก 2557
602,คู่มือสอบพระธรรมนูญศาลยุติธรรม,9.78616E+12,5,หมวดกฎหมายระหว่างประเทศ,KPT1572 อ261 2559
603,คำศัพท์ภาษาอังกฤษสำหรับนักกฎหมาย,9.78616E+12,2,หมวดกฎหมายระหว่างประเทศ,PE1116 ด174 2559
604,คู่มือสอบพยายหลักฐาน,9.78616E+12,5,หมวดกฎหมายระหว่างประเทศ,KPT1672 อ261 2559
605,หลักกฎหมายว่าด้วยองค์กรอัยการและพนักงานอัยการ,9.78616E+12,2,หมวดกฎหมายระหว่างประเทศ,KPT1615 ส866 2559
606,เตรียมสอบเข้านิติศาสตร์ ความรู้เบื้องต้นเกี่ยยวกับกฎหมายทั่วไป,9.78616E+12,2,หมวดกฎหมายระหว่างประเทศ,KPT68 พ274 2558
607,หลักการทำสัญญาและตัวอย่างสัญญาต่างๆ เล่ม 1,9.78616E+12,2,หมวดกฎหมายระหว่างประเทศ,KPT858 ส852 2557
608,คำถามพร้อมธงคำตอบ ข้อสอบการคัดเลือกเพื่อบรรจุเป็นข้าราชการอัยการ ในตำแหน่งอัยการผู้ช่วย,9.78616E+12,2,หมวดกฎหมายระหว่างประเทศ,KPT1615 ร122 2558
609,กฎหมายเกี่ยวกับการท่องเที่ยว,9.78974E+12,5,หมวดกฎหมายระหว่างประเทศ,KPT3425 ค127 2558
610,กฎหมายเกี่ยวกับการควบคุมและป้องกันโรคระบาดในสัตว์เลี้ยง,9.78974E+12,2,หมวดกฎหมายระหว่างประเทศ,SF780.9 ช627 2555
611,กฎหมายเกี่ยวกับการเกษตร,9.78974E+12,5,หมวดกฎหมายระหว่างประเทศ,KPT3295 อ727 2557
612,ไต้หวันในความสัมพันธ์ระหว่างประเทศ,9.78974E+12,5,หมวดกฎหมายระหว่างประเทศ,DS799.625 ส723 2558
613,เศรษฐศาสตร์การจัดการ,9.78974E+12,5,หมวดกฎหมายระหว่างประเทศ,HD30.22 น232 2558
614,วิชาสุดท้ายที่มหาวิทยาลัยไม่ได้สอน,9.78617E+12,2,หมวดกฎหมายระหว่างประเทศ,PN6129.T5 ว549 2559/20
615,นิติปรัชญา...ภาษาอังกฤษกฎหมาย,9.78617E+12,2,หมวดกฎหมายระหว่างประเทศ,K230 ค144 2558
616,อธิบายหลักกฏหมายอุทยานแห่งชาติและหลักกฎหมายที่เกี่ยวข้องกับการปฏิบัติงานด้านอุทยานและป่าไม,9.78617E+12,2,หมวดกฎหมายระหว่างประเทศ,KPT3336 ส821 2559
617,อธิบายกฎหมายป่าไม้,9.78617E+12,2,หมวดกฎหมายระหว่างประเทศ,KPT3336 ส821 2558
618,ภาษีอากรตามประมวลรัษฎากร 2559,9.78616E+12,2,หมวดกฎหมายระหว่างประเทศ,HJ2950.55 ภ491 2559
619,คำอธิบายกฎหมายว่าด้วยองค์กรอัยการและพนักงานอัยการ,9.78616E+12,5,หมวดกฎหมายระหว่างประเทศ,KPT1615 อ686 2559
620,คำอธิยายกฎหมายอุ้มบุญ,9.78616E+12,2,หมวดกฎหมายระหว่างประเทศ,KPT3117 ย158 2558
621,ประวัติศาสตร์กฎหมายไทย,9.78616E+12,2,หมวดกฎหมายระหว่างประเทศ,KPT120 อ281 2559
622,ประมวลกฎหมายอาญา ฉบับอ้างอิง,9.78616E+12,2,หมวดกฎหมายระหว่างประเทศ,KPT3800 ท189ป 2559
623,กฎหมายระหว่างประเทศ เล่ม 1,9.78616E+12,2,หมวดกฎหมายระหว่างประเทศ,KZ3410 จ637ก 2559
624,แนวทางการเขียนตอบข้อสอบกฎหมายสำหรับผู้เริ่มต้นศึกษากฎหมาย,9.78616E+12,2,หมวดกฎหมายระหว่างประเทศ,KPT70 ม628 2559
625,กฎหมายรัฐธรรมนูญ,9.78052E+12,5,หมวดกฎหมายระหว่างประเทศ,KPT2110 บ572 2559
626,International Law,9.78974E+12,5,หมวดกฎหมายระหว่างประเทศ,KZ3410 J85 2016
627,กฎหมายการเยียวยาผู้ได้รับความเสียหายจากสินค้า,9.78974E+12,5,หมวดกฎหมายระหว่างประเทศ,KPT846.5 อ165 2559
628,คำอธิบายสถาบันอุดมศึกษาเอกชน,9.78616E+12,5,หมวดกฎหมายระหว่างประเทศ,KPT3147 ด554 2558
629,คู่มือการศึกษา วิชากฎหมายการค้าระหว่างประเทศว่าด้วยการรับขนของทางทะเล,9.78616E+12,5,หมวดกฎหมายระหว่างประเทศ,KPT3470 อ353 2559
630,หลักการทำสัญญาและตัวอย่างสัญญา,9.78616E+12,2,หมวดกฎหมายอาญาและฯ,KPT858 ส852 2559
631,ศิลปะการร่างคำคู่ความ ตอน 1,9.78974E+12,2,หมวดกฎหมายอาญาและฯ,K2231 ว561 2551 ล.1
632,มุมมองใหม่ในกฎหมายอาญา,9.78616E+12,2,หมวดกฎหมายอาญาและฯ,KPT3800 ท189 2556
633,ยอมไม่ได้ (รวมเรื่องสั้นหลักกฎหมายชาวบ้าน),9.78616E+12,2,หมวดกฎหมายอาญาและฯ,KPT68 ท189 2556
634,สิทธิพื้นฐานในคดีอาญา,9.78974E+12,2,หมวดกฎหมายอาญาและฯ,KPT3800 ม484ส 2550
635,ปฏิรูปกระบวนการยุติธรรมทางอาญา,9.78974E+12,2,หมวดกฎหมายอาญาและฯ,HV9960.T5 ค129
636,ความเป็นมาและหลักการใช้นิติวิธีซิวิลลอว์,9.78616E+12,2,หมวดกฎหมายอาญาและฯ,K155 ก675 2560
637,คำอธิบายความผิดเกี่ยวกับการปลอมและการแปลงตามประมวลกฎหมายอาญา,9.78616E+12,2,หมวดกฎหมายอาญาและฯ,KPT3878 ส854
638,คำอธิบายความผิดเกี่ยวกับทรัพย์ ตามประมวลกฎหมายอาญา,9.78616E+12,5,หมวดกฎหมายอาญาและฯ,K ส854ค 2559
639,กฎหมายว่าด้วยการบังคับโทษจำคุก,9.78616E+12,5,หมวดกฎหมายอาญาและฯ,KPT3800 ธ517 2558
640,คำอธิบายกฎหมายวิธีพิจารณาความแพ่ง ภาค 3,9.78616E+12,2,หมวดกฎหมายอาญาและฯ,KPT1710 ป615 2557
641,หลักและทฤษฎีกฎหมายวิธีพิจารณาความแพ่ง เล่ม 1,9.78616E+12,2,หมวดกฎหมายอาญาและฯ,KPT1710 ว244 2556
642,อาชญวิทยาและทัณฑวิทยา,9.78616E+12,2,หมวดกฎหมายอาญาและฯ,HV6026.T5 อ514 2557
643,กฎหมายลักษณะพยาน,9.78616E+12,2,หมวดกฎหมายอาญาและฯ,KPT1672 ส867 2557
644,คำอธิบายพระราชบัญญัติส่งผู้ร้ายข้ามแดน พ.ศ.2551 หลักกฎหมายและทางปฏิบัติ.,9.78616E+12,2,หมวดกฎหมายอาญาและฯ,KPT4660 ต247 2557
645,กฎหมายราชทัณฑ์,9.78616E+12,2,หมวดกฎหมายอาญาและฯ,KPT3946 ธ517 2558
646,คำอธิบายกฎหมายอาญาภาคความผิด เล่ม 1.,9.78616E+12,2,หมวดกฎหมายอาญาและฯ,KPT3878 ค119 2559
647,คำอธิบายกฎหมายอาญา ภาคความผิด เล่ม 2.,9.78616E+12,2,หมวดกฎหมายอาญาและฯ,KPT3878 ค119 2559
648,กฎหมายอาญาชั้นสูง,9.78616E+12,4,หมวดกฎหมายอาญาและฯ,KPT3800 ป115 2559
649,ประมวลกฎหมายอาญา ฉบับหัวเรื่องเรียงมาตรา,9.78616E+12,2,หมวดกฎหมายอาญาและฯ,KPT3800 ป352ม 2557
650,ประมวลกฏหมายวิธีพิจารณาความอาญา,9.78616E+12,2,หมวดกฎหมายอาญาและฯ,KPT4610ป349อ 2555
651,ประมวลกฎหมายวิธีพิจารณาความอาญา หลักกฎหมายและะพื้นฐานการเข้าใจ,9.78616E+12,2,หมวดกฎหมายอาญาและฯ,KPT4610 ค129ป 2556
652,ประมวลกฎหมายอาญา หลักกฎหมายและพื้นฐานการเข้าใใจ,9.78616E+12,2,หมวดกฎหมายอาญาและฯ,KPT3800 ค129 2559
653,ประมวลกฎหมายอาญา ฉบับไทย-อังกฤษ,9.78616E+12,2,หมวดกฎหมายอาญาและฯ,KPT3800 ป352 2556
654,กฎหมายอาญาระหว่างประเทศ,9.78616E+12,2,หมวดกฎหมายอาญาและฯ,KZ3410 ส258 2556
655,นิติเวชศาสตร์และกฎหมายการแพทย์,9.78616E+12,2,หมวดกฎหมายอาญาและฯ,RA1027.5 น589 2557
656,เชิงทนาย,9.78616E+12,2,หมวดกฎหมายอาญาและฯ,KPT1630 ค142 2556
657,วิชาว่าความและมรรยาททนายความ,9.78616E+12,2,หมวดกฎหมายอาญาและฯ,K117 ม484 2559
658,หลักกฎหมายว่าด้วยวิธีพิจารณาความอาญาในศาลแขวง,9.78616E+12,2,หมวดกฎหมายอาญาและฯ,KPT4610 ส863 2559
659,หลักกฎหมายการคลัง,9.78616E+12,2,หมวดกฎหมายอาญาและฯ,KPT3526 อ929 2558
660,หลักกฎหมายมาตการบังคับทางอาญา,9.78616E+12,2,หมวดกฎหมายอาญาและฯ,KPT3878 ธ517
661,ทฤษฎีอาญา,9.78616E+12,2,หมวดกฎหมายอาญาและฯ,KPT3800 อ262 2556
662,การปฏิรูประบบกฎหมายไทยภายใต้อิทธิพลยุโรป,9.78616E+12,2,หมวดกฎหมายอาญาและฯ,KPT120 ก675 2556
663,คำอธิบายวิชาว่าความและศาลจำลอง,9.78616E+12,2,หมวดกฎหมายอาญาและฯ,KPT1630 จ638 2559
664,พรบ.ว่าด้วยความผิดคอมฯ,9.78974E+12,2,หมวดวิชากฎหมายเอกชนและฯ,KPT80.C65 พ371 2553
